text,offset,length,author
"and pumps about five quarts of blood each minute, or 75 gallons of blood every hour. ",0,85,1
"The heart is a muscle that pumps blood around the body. It consists of four chambers two atria at the top and two ventricles at the bottom that contract (or beat) in a regular, highly coordinated organized rhythm. ",86,214,1
"What is an arrhythmia?
Normal heart beat is a regular, consistent and coordinated rhythm, speeding up or slowing down in response to physical activity or to an emotional event. ",245,177,1
This regular rhythmic pattern can be disrupted by various conditions causing the heart to beat either inappropriately slow or fast or in an uncoordinated manner. ,400,162,1
"Any such irregular heartbeat is called an arrhythmia. Arrhythmias are very common, especially in older people, but it may occur in children or younger people. ",563,159,1
"While some arrhythmias are harmless, others can be serious, leading to heart disease, stroke, or sudden cardiac death. ",669,119,1
"Fortunately, most of these arrhythmias can be controlled with medicines, implantable devices such as pacemakers, or surgical procedures. ",789,137,1
"Types of Arrhythmia Cardiac arrhythmias sometimes are classified according to their origin as either ventricular arrhythmias (originating in the ventricles) or supraventricular arrhythmias (originating in heart areas above the ventricles, typically the atria) Bradycardia indicates a heart rate of less than 60 beats per minute and tachycardia indicates a heart rate of more than 100 beats per minute. ",927,402,1
"Sinus bradycardia. Sinus node sends ou signals at a slower rate than normal It includes normal decrease in heart rate during rest and sleep as well as athletes.
",1330,161,1
At this slow rate the heart is unable to pump enough oxygenated blood to the body to sustain normal activity or mild exercise. ,1473,127,1
"As a result, the person may feel dizzy or have chronic lack of energy, shortness of breath, or even fainting spells. ",1601,117,1
"Sinus Bradycardia
A sinus rate of < 60 beats/minute.
Sinus bradycardia may be normal finding during sleep, in athletes it may be an indication of excellent physical conditioning; however, in the elderly, it often an indicates of sinus node disease.
",1861,249,0
"Inferior MI, hypothermia, myxedema, or increased intracranial pressure may cause this arrhythmia. ",2058,98,0
"For apparently healthy persons aged 40 to 80 with sinus rates < 50 beats/minute, 5-year cardiovascular morbidity and mortality rates do not appear to be increased. ",2157,164,0
"Treatment is not needed unless symptoms of cerebral hypoperfusion are present. If such symptoms are chronic, pacemaker implantation is the definitive treatment.
",2322,161,0
"Sinoatrial Block
Inability of sinus node impulses to depolarize the atria.
Sinoatrial block is often 2:1, resulting in atrial and ventricular rates that are exactly one half the sinus rate. ",2405,190,0
"In the elderly, common causes are intrinsic conduction system disease, ischemia, digitalis toxicity, and toxicity from class Ia antiarrhythmics. ",2521,145,0
The diagnosis is made when an ECG shows a pause in the sinus rhythm equal to a multiple of the underlying PR interval. ,2667,119,0
"Treatment is similar to that for sinus bradycardia.
First-degree atrioventricular block: First-degree block may occur in healthy persons with high vagal tone, or it may be caused by intrinsic conduction system disease or by various drugs (eg, digoxin, beta-blockers, calcium channel blockers, class Ia antiarrhythmic drugs). ",2787,325,0
"The PR interval is prolonged (>= 0.22 seconds). It does not significantly increases cardiac morbidity and mortality of patients, no treatment is required.
",3061,155,0
"Second-degree atrioventricular block: It may occur in three different patterns. In Mobitz type I (Wenckebach) block, the PR interval is progressively prolonged until a QRS complex is dropped. ",3169,192,0
"Because this block is usually above the level of the His-Purkinje system, the QRS complex typically appears normal. ",3282,116,0
"Digitalis toxicity and acute inferior MI are common precipitating factors. Mobitz type I block is usually transient, resolves spontaneously and specific treatment is rarely needed.
",3399,181,0
"In Mobitz type II block, the PR interval is fixed, but QRS complexes are dropped resulting in dropped ventricular contraction. ",3506,127,0
"Because the conduction block occurs at or below the His bundle, the QRS complexes are often wide. ",3634,98,0
"Mobitz type II block is most commonly caused due to acute anterior MI, myocarditis, or advanced sclerodegenerative conduction system disease. ",3733,142,0
Patients with this block are usually symptomatic and presents with complaints of syncope due to inadequate cerebral perfusion (Stokes-Adams attack). ,3876,149,0
"Because of the dangerous symptoms and frequent progression to complete heart block, treatment is usually needed and patients are implanted with a permanent pacemaker.
",4026,167,0
"If the block is of high-grade, there may be a mathematical relationship between the P waves and QRS complexes such as 2:1, 3:1. ",4194,128,0
"High-grade block may progress to complete heart block. Patients are often symptomatic and usually treated by implantation of a permanent pacemaker.
",4323,148,0
Third-degree (complete) atrioventricular block: Impulses arising in atria cannot travel down to ventricles. ,4417,108,0
"V entricles cannot be activated by a trial depolarizations. If the block is within the AV node, QRS complexes are usually normal and an escape rate of almost 60 beats/minute. ",4526,175,0
Common causes of third-degree AV block include acute inferior MI and digitalis toxicity. ,4642,89,0
"This block is usually transient, and no specific treatment is not needed. If it is caused by digitalis toxicity, the drug is stopped. ",4732,134,0
"Temporary pacemakers may be needed when hypotension or symptoms of cerebral hypoperfusion are present.
",4793,103,0
"If block is within the ventricles, it is accompanied by wide QRS complexes and a slow escape rate usually < 40 beats/minute. ",4897,125,0
Such block may occur in patients with severe sclerodegenerative conduction system disease or extensive acute anterior MI. ,5023,122,0
"These patients usually respond poorly to medical treatment with atropine and isoproterenol, implantation of permanent pacemaker is usually necessary.
",5146,150,0
"Sick Sinus Syndrome or Sinus node dysfunction
A variety of rhythm disturbances that reflect sinoatrial node dysfunction and are often associated with dysfunction elsewhere in the conduction system.
",5297,198,0
"Coronary artery disease and primary sclerodegenerative process are the most common precipitating factors, although it may be precipitated by many other heart diseases. ",5450,168,0
"Patients may present with bradyarrhythmias (sinus bradycardia, sinus pauses or arrest, sinoatrial exit block, or atrial fibrillation with a slow ventricular response) or with the bradycardia-tachycardia syndrome, in which a supraventricular tachycardia terminates in a long period of asystole. ",5619,294,0
"Thus patients present with combined symptoms of palpitations or chest pain during tachycardia and dizziness or syncope during bradycardia.
",5914,139,0
"The long-term prognosis for patients with sick sinus syndrome is primarily dependent on the presence and severity of the underlying heart disease.
",6054,147,0
"For tachycardia (paroxysmal supraventricular tachycardia, atrial flutter, or atrial fibrillation), digoxin, other antiarrhythmic drugs, or cardioversion is used.
",6202,162,0
"For bradycardia associated with syncope, a permanent pacemaker is needed.
Partial or complete interruption of electrical conduction in the bundle branches.
",6365,156,0
Left bundle branch block is usually associated with ischemic or hypertensive heart disease in elderly men and women. ,6448,117,0
"In contrast, complete right bundle branch block often occurs in apparently healthy elderly men and appears to be benign, although it is highly predictive of underlying heart disease in elderly women.
",6566,200,0
"Pacemakers are not warranted for asymptomatic elderly patients with chronic bifascicular block (either left or right bundle branch block plus left anterior-superior or left posterior-inferior division block), with or without a prolonged PR interval, because complete heart block rarely occurs
",6767,293,0
"Symptoms, Signs, and Diagnosis
Bradycardias may produce no symptoms, mild fatigue or faintness, or significant hemodynamic upset (eg, hypotension, angina, heart failure). ",7061,171,0
"The diagnosis may be suspected on the basis of symptoms and signs but is confirmed by ECG.
",7202,91,0
"Patients having bradyarrhythmia must be treated immediately if they are having hypotension, cerebral or cardiac ischemia, heart failure, and/or, in acute MI, frequent ventricular ectopic beats.",7294,193,0
Making the patient position supine with the legs elevated can be helpful in ameliorating hypotensive sequelae. ,7488,111,0
Atropine 0.5 to 1 mg is given rapidly IV; and may be repeated at 3- to 5-minute intervals. ,7600,91,0
"Total dose may go upto 0.04 mg/kg (total, 2 to 3 mg). If the patient is unable to toerate atropine or is ineffective, an IV infusion of isoproterenolcan be started at 1 to 4 µg/minute and drip rate adjusted to produce a ventricular rate of 60 beats/minute. ",7692,257,0
"If none of these are successful or contraindicated, then temporary pacemakers should be inserted.
",7896,98,0
Cardiac pacemakers: More than 85% of patients having pacemaker are more than 64 years and about half of them are treated for high-degree AV block and almost other half for sick sinus syndrome. ,7995,193,0
"Insertion of permanent pacemaker has reduced the high mortality associated with these conditions.
",8189,98,0
Active elderly patients may get more benefit from dual-chamber AV synchronous pacemakers which improves maximal exercise cardiac output and work capacitycompared to traditional fixed-rate ventricular pacemakers. ,8288,212,0
"Additionally, the incidence of atrial fibrillation and the mortality rate is greater in patients with ventricular pacemakers than patients having atrial or dual-chamber AV synchronous pacemakers. ",8501,196,0
"The incidence of atrial fibrillation is 47% in patients > 70 with sick sinus syndrome having a ventricular pacemaker and in 9% in those who are having a dual-chamber pacemaker after 7 years; the mortality rates were reported as 72% and 51%, respectively. ",8698,255,0
"Thus, for an otherwise healthy person who are in sinus rhythm and need pacemaker for sick sinus syndrome an AV synchronous pacemaker should be preferred.
",8954,154,0
"Complications of Pacemakers
These are rare but significant. There may be abrupt loss of pacing due to battery failure, fibrosis around the catheter site, myocardial perforation, lead fracture, or electrode dislodgment. ",9109,219,0
"This may result in bradycardia or even asystole. Perforation may result in pericardial friction rub or, rarely, tamponade. ",9269,123,0
"Rarely, there may be extrusion of the pulse generator or the pacing wire through the skin. ",9344,91,0
"All patients with a permanent pacemaker should undergo regular follow-up.
",9436,74,0
"Sick sinus syndrome Bradyarrhythmias are well controlled with pacemakers, while medication are given to control tachyarrhythmias. ",10454,130,1
"As both bradyarrhythmias and tachyarrhythmias are present, medications prescribed to control tachyarrhythmia may exacerbate bradyarrhythmia. ",10585,141,1
"Thus, a pacemaker is implanted before medications are started for the tachyarrhythmia.
",10727,87,1
