text,offset,length,author
"In most parts of the world that are already industrialized and very much driven by business, particularly in major metropolitan areas such as Manhattan and other states in the United States, GMAT prep courses are almost a rite of passage for prospective M.B.A. students. ",0,271,1
"Thus, GMAT is a very important and people really exert effort to pass the examination.
",272,87,1
"One-on-One Test Prep for the SAT, TOEFL, GRE, & GMAT
The University of Georgia also known as UGA takes the stress out of a person or a student's having to fit into a course schedule! ",358,183,0
This can be very tiring especially if one wants to take several exams and have to take several review classes as well. ,489,119,0
"One-on-One test prep classes, offered by UGA are available for working and busy people who can't fit into a set schedule or for those who need more individualized attention for specific questions and concerns. ",609,210,0
A minimum of 6 hours of instruction for a personalized approach is required. Prices will vary dependent on the personal need by a student. ,820,139,0
The cost of the one-on-one test pre may be shared by up to three people. The textbooks and other materials used for the review may incur a separate fee. ,883,153,0
"Call 706-542-3537 or 1-800-811-6640 for details.
The University of Georgia test prep advantage:
",964,96,0
"• Innovative, one-of-a-kind curricula: UGA test prep classes are designed and framed by professional test item writers, with years of expertise and experience writing questions for the GRE, GMAT, LSAT, and SAT! ",1012,211,0
Only UGA test prep courses allow the students to look at the tests through the eyes of a test writer. ,1224,102,0
The students of UGA have access to the unparalleled insight into the questions in different fields and an edge no other test prep company can match. ,1327,149,0
"All class sessions are presented in a computer using the software PowerPoint, making them super-efficient and perfectly clear and understandable for the students. ",1477,163,0
"The students will learn twice as fast as with standard, write-on-the-board classes. ",1641,84,0
"Also, all the classes use only real test questions GMAT so that a person will know just what to expect on test day.
",1726,116,0
• Instructors with years of test prep experience: Every UGA test prep instructor and teacher has at least five years of standardized test teaching experience which make him an expert of the subject matter. ,1843,206,0
"The instructor will be a test prep pro who not only ""aced"" or got high grades in the test but who also has helped hundreds of students reach their standardized testing goals! ",2050,175,0
"Thus, the teachers will have experience in interacting with previous students.
• Small classes for personalized attention: Most UGA test prep classes have fewer than 15 students with the maximum of 25 students to ensure that every student gets the individualized attention that he or she deserves in the class. ",2226,311,0
This ensures that a concern raised by a student will be addressed. The student will also get 24/7 student support. ,2459,115,0
"Not only will the assigned instructor be available outside of class to answer any question that a student may have, but the student can talk to the class designers directly! ",2508,174,0
"Every UGA test prep student has the cell phone number and the email address and other contact details of the person who designed their test prep class, so that whenever students have a question you can go straight to the source!",2683,228,0
